ani-din-1,Tricératops,Une peluche de tricératops top mega cool,26.95,1,0,50,12x7,m,bleu,Bellzi
ani-din-2,T-Rex,Une peluche de T-Rex top mega cool,26.95,0,20,70,6x11,m,rouge,Bellzi
ani-mer-1,Narval,Une peluche de narval top mega cool,18.95,1,0,150,13x5.5,m,bleu,Bellzi
ani-mer-2,Pingouin,Une peluche de pingouin top mega cool,26.95,0,0,15,6.5x11,m,autre,Bellzi
ani-for-1,Biche,Une peluche de biche top mega cool,26.95,0,50,20,10x8,m,marron,Bellzi
ani-for-2,Renard,Une peluche de renard top mega cool,26.95,0,0,1,10x6,m,orange,Bellzi
ani-fan-1,Dragon,Une peluche de dragon top mega cool,36.95,1,0,30,6.5x11.5,m,rouge,Bellzi
ani-fan-2,Wyverne (mini),Une mini peluche de wyverne top mega cool,18.95,0,10,40,4.5x6.5,p,violet,Bellzi
ani-for-3,Ours polaire (grand),Une grande peluche d'ours polaire top mega cool,90.95,0,0,20,10x17,g,blanc,Bellzi
ani-for-4,Panda roux (grand),Une grande peluche de panda roux top mega cool,90.95,1,10,25,12x20,g,orange,Bellzi
ani-for-5,Panda (mini),Une mini peluche de panda top mega cool,13.95,1,0,90,3x6,p,autre,Bellzi
pop-man-1,Totoro (géant),Une peluche géante de Totoro top mega cool,149.99,0,0,10,120x120,x,gris,Sun Arrow
pop-man-2,Totoro,Une peluche de Totoro top mega cool,24.99,0,19,30,6x10,m,gris,Gund
pop-man-3,Calcifer,Une peluche de Calcifer top mega cool,21.90,1,0,70,6x10,m,rouge,Sun Arrow
pop-man-4,Chopper,Une peluche de Chopper top mega cool,24.90,0,10,150,5x14,m,autre,Sakami Merchandise
pop-fil-1,Aquaman,Une peluche d'Aquaman top mega cool,13.90,1,0,200,5x10,p,autre,Funko
pop-fil-2,Batman,Une peluche de Batman top mega cool,19.90,1,0,200,6x13,m,noir,Funko
pop-fil-3,Doby,Une peluche de Doby top mega cool,44.90,0,20,10,18x40,g,beige,Funko
pop-fil-4,Voldemort,Une peluche de Voldemort top mega cool,19.90,0,0,25,5x10,p,autre,Funko
pop-jeu-1,Among Us,Une peluche de Among Us top mega cool,24.90,1,0,500,15x40,g,noir,Yume Toys
pop-jeu-2,Bobomb,Une peluche de Bobomb top mega cool,22.90,0,40,35,10x15,m,noir,Jakks Pacific
pop-jeu-3,Banzai Bill,Une peluche de Banzai Bill top mega cool,38.90,0,0,50,20x15,g,noir,Sanei
pop-jeu-4,Super Champignon,Une peluche de Super Champignon top mega cool,22.90,0,10,40,10x10,m,rouge,Jakks Pacific
aut-emo-1,Nuage content,Une peluche de nuage content top mega cool,16.85,1,0,50,10x10,m,blanc,Pig Oink Store
aut-emo-2,Emoji clin d'oeil,Une peluche d'emoji clein d'oeil top mega cool,5.69,1,10,20,30x30,g,jaune,OUTAD
aut-emo-3,Emoji content,Une peluche d'emoji content top mega cool,15.19,0,0,40,30x30,g,jaune,OUTAD
aut-pla-1,Orchidée,Une peluche d'orchidée top mega cool,48.40,1,0,69,10x30,g,autre,Jellycat
aut-pla-2,Silly Sucullent Jade,Une peluche de Silly Sucullent Jade top mega cool,22.30,0,15,99,8x16,m,autre,Jellycat
aut-pla-3,Cactus,Une peluche de cactus top mega cool,21.90,0,0,133,10x15,m,autre,Jellycat
aut-nou-1,Sandwich,Une peluche de sandwich top mega cool,31.73,0,0,24,15x10,m,autre,Jellycat
aut-nou-2,Brie,Une peluche de brie top mega cool,25.90,0,0,45,30x14,g,blanc,Jellycat
aut-nou-3,Bretzel,Une peluche de bretzel top mega cool,26.40,0,0,98,22x22,g,marron,Jellycat
